{
  "baseline_registry": [
    {
      "family": "majority",
      "id": "majority",
      "implementation_status": "implemented_requires_training_labels"
    },
    {
      "family": "class_prior",
      "id": "class-prior",
      "implementation_status": "implemented_requires_training_labels"
    },
    {
      "family": "lexical_features",
      "id": "lexical-edit",
      "implementation_status": "feature_extractor_implemented_requires_complete_pairs"
    },
    {
      "family": "amendment_operation",
      "id": "amendment-operation",
      "implementation_status": "feature_extractor_implemented"
    },
    {
      "family": "rule_legal_cues",
      "id": "rule-legal-cues",
      "implementation_status": "feature_extractor_implemented"
    },
    {
      "family": "generic_document_revision",
      "id": "generic-document-revision",
      "implementation_status": "not_selected_or_executed"
    },
    {
      "family": "zero_shot_llm",
      "id": "zero-shot-llm",
      "implementation_status": "not_executed_no_model_or_gold"
    },
    {
      "family": "few_shot_llm",
      "id": "few-shot-llm",
      "implementation_status": "not_executed_no_model_or_gold"
    },
    {
      "family": "legal_encoder",
      "id": "legal-encoder",
      "implementation_status": "not_executed_no_model_or_gold"
    },
    {
      "family": "long_context_encoder",
      "id": "long-context-encoder",
      "implementation_status": "not_executed_no_model_or_gold"
    },
    {
      "family": "closest_work_inspired",
      "id": "closest-work-inspired",
      "implementation_status": "methodology_not_claimed_as_reproduction"
    },
    {
      "family": "proposed_model",
      "id": "proposed-materiality-model",
      "implementation_status": "optional_not_implemented"
    }
  ],
  "experiment_id": "phase8-baseline-dry-run-v1",
  "feature_rows": [
    {
      "after_character_count": 996,
      "before_character_count": null,
      "cue_counts": {
        "definition": 0,
        "duty": 4,
        "exception": 0,
        "penalty": 0,
        "prohibition": 0,
        "right": 0,
        "threshold": 0,
        "time": 0
      },
      "gold_label": null,
      "has_complete_before_after": false,
      "instruction_character_count": 834,
      "normalized_edit_ratio": null,
      "operation": "substitution",
      "pair_id": "pair_15651fe59b37869adf988286"
    },
    {
      "after_character_count": 3209,
      "before_character_count": null,
      "cue_counts": {
        "definition": 0,
        "duty": 2,
        "exception": 1,
        "penalty": 0,
        "prohibition": 0,
        "right": 1,
        "threshold": 0,
        "time": 1
      },
      "gold_label": null,
      "has_complete_before_after": false,
      "instruction_character_count": 2148,
      "normalized_edit_ratio": null,
      "operation": "insertion",
      "pair_id": "pair_96cc0e894a99b16d7e62e26d"
    },
    {
      "after_character_count": 3209,
      "before_character_count": null,
      "cue_counts": {
        "definition": 0,
        "duty": 1,
        "exception": 0,
        "penalty": 0,
        "prohibition": 0,
        "right": 0,
        "threshold": 0,
        "time": 0
      },
      "gold_label": null,
      "has_complete_before_after": false,
      "instruction_character_count": 1029,
      "normalized_edit_ratio": null,
      "operation": "substitution",
      "pair_id": "pair_16ac9c20df18b3437edf24ab"
    },
    {
      "after_character_count": 1154,
      "before_character_count": null,
      "cue_counts": {
        "definition": 0,
        "duty": 1,
        "exception": 0,
        "penalty": 0,
        "prohibition": 0,
        "right": 0,
        "threshold": 0,
        "time": 0
      },
      "gold_label": null,
      "has_complete_before_after": false,
      "instruction_character_count": 1118,
      "normalized_edit_ratio": null,
      "operation": "substitution",
      "pair_id": "pair_2723036b35a4463039742860"
    },
    {
      "after_character_count": 5472,
      "before_character_count": null,
      "cue_counts": {
        "definition": 8,
        "duty": 10,
        "exception": 0,
        "penalty": 16,
        "prohibition": 0,
        "right": 12,
        "threshold": 4,
        "time": 0
      },
      "gold_label": null,
      "has_complete_before_after": false,
      "instruction_character_count": 10553,
      "normalized_edit_ratio": null,
      "operation": "substitution",
      "pair_id": "pair_a176d5c8271272a6a9de30ac"
    },
    {
      "after_character_count": 3912,
      "before_character_count": null,
      "cue_counts": {
        "definition": 0,
        "duty": 3,
        "exception": 1,
        "penalty": 1,
        "prohibition": 0,
        "right": 5,
        "threshold": 0,
        "time": 1
      },
      "gold_label": null,
      "has_complete_before_after": false,
      "instruction_character_count": 2597,
      "normalized_edit_ratio": null,
      "operation": "insertion",
      "pair_id": "pair_9481c09e4d55eed2f452a4c4"
    },
    {
      "after_character_count": 1449,
      "before_character_count": null,
      "cue_counts": {
        "definition": 8,
        "duty": 10,
        "exception": 0,
        "penalty": 16,
        "prohibition": 0,
        "right": 12,
        "threshold": 4,
        "time": 0
      },
      "gold_label": null,
      "has_complete_before_after": false,
      "instruction_character_count": 10553,
      "normalized_edit_ratio": null,
      "operation": "substitution",
      "pair_id": "pair_54fa7db6aaa811c5473c5662"
    },
    {
      "after_character_count": 996,
      "before_character_count": null,
      "cue_counts": {
        "definition": 0,
        "duty": 2,
        "exception": 0,
        "penalty": 2,
        "prohibition": 0,
        "right": 0,
        "threshold": 0,
        "time": 0
      },
      "gold_label": null,
      "has_complete_before_after": false,
      "instruction_character_count": 1253,
      "normalized_edit_ratio": null,
      "operation": "insertion",
      "pair_id": "pair_b1258e4f5cd6609d8dfc55d9"
    },
    {
      "after_character_count": 2236,
      "before_character_count": null,
      "cue_counts": {
        "definition": 0,
        "duty": 1,
        "exception": 0,
        "penalty": 0,
        "prohibition": 0,
        "right": 0,
        "threshold": 0,
        "time": 0
      },
      "gold_label": null,
      "has_complete_before_after": false,
      "instruction_character_count": 1118,
      "normalized_edit_ratio": null,
      "operation": "substitution",
      "pair_id": "pair_bd2139bf814ba07d5156db7f"
    },
    {
      "after_character_count": 1449,
      "before_character_count": null,
      "cue_counts": {
        "definition": 0,
        "duty": 1,
        "exception": 0,
        "penalty": 0,
        "prohibition": 0,
        "right": 0,
        "threshold": 0,
        "time": 0
      },
      "gold_label": null,
      "has_complete_before_after": false,
      "instruction_character_count": 1118,
      "normalized_edit_ratio": null,
      "operation": "substitution",
      "pair_id": "pair_5e12622b92b694172c6e301e"
    },
    {
      "after_character_count": 9556,
      "before_character_count": null,
      "cue_counts": {
        "definition": 0,
        "duty": 1,
        "exception": 0,
        "penalty": 0,
        "prohibition": 0,
        "right": 0,
        "threshold": 0,
        "time": 0
      },
      "gold_label": null,
      "has_complete_before_after": false,
      "instruction_character_count": 1029,
      "normalized_edit_ratio": null,
      "operation": "substitution",
      "pair_id": "pair_2c7ac07d92765ef75f6f5101"
    },
    {
      "after_character_count": 1418,
      "before_character_count": null,
      "cue_counts": {
        "definition": 0,
        "duty": 2,
        "exception": 0,
        "penalty": 0,
        "prohibition": 0,
        "right": 0,
        "threshold": 0,
        "time": 0
      },
      "gold_label": null,
      "has_complete_before_after": false,
      "instruction_character_count": 352,
      "normalized_edit_ratio": null,
      "operation": "substitution",
      "pair_id": "pair_e0b7ffcbcfacaa904a0e0548"
    },
    {
      "after_character_count": 5387,
      "before_character_count": null,
      "cue_counts": {
        "definition": 4,
        "duty": 1,
        "exception": 0,
        "penalty": 0,
        "prohibition": 0,
        "right": 4,
        "threshold": 0,
        "time": 0
      },
      "gold_label": null,
      "has_complete_before_after": false,
      "instruction_character_count": 1489,
      "normalized_edit_ratio": null,
      "operation": "insertion",
      "pair_id": "pair_208717a68116ca2157c46a91"
    },
    {
      "after_character_count": 284,
      "before_character_count": null,
      "cue_counts": {
        "definition": 0,
        "duty": 1,
        "exception": 0,
        "penalty": 0,
        "prohibition": 0,
        "right": 0,
        "threshold": 0,
        "time": 0
      },
      "gold_label": null,
      "has_complete_before_after": false,
      "instruction_character_count": 132,
      "normalized_edit_ratio": null,
      "operation": "complex_or_unresolved",
      "pair_id": "pair_d72ad7774b521ab04a88ebee"
    },
    {
      "after_character_count": 1128,
      "before_character_count": null,
      "cue_counts": {
        "definition": 1,
        "duty": 2,
        "exception": 0,
        "penalty": 0,
        "prohibition": 1,
        "right": 1,
        "threshold": 0,
        "time": 0
      },
      "gold_label": null,
      "has_complete_before_after": false,
      "instruction_character_count": 645,
      "normalized_edit_ratio": null,
      "operation": "complex_or_unresolved",
      "pair_id": "pair_7577d313b43ae9fdf32ea03d"
    },
    {
      "after_character_count": null,
      "before_character_count": null,
      "cue_counts": {
        "definition": 0,
        "duty": 4,
        "exception": 0,
        "penalty": 0,